{
  "target": "https://example.com",
  "timestamp": "2025-01-01T00:00:00Z",
  "source_artifacts": ["web_surface.json"],
  "candidates": [
    {
      "id": "cand_001",
      "type": "missing_security_headers",
      "title": "Missing headers",
      "description": "Missing headers",
      "evidence": [
        { "kind": "header", "value": "missing: x" }
      ],
      "confidence": "medium",
      "severity_hint": "medium",
      "tags": ["headers"],
      "refs": []
    }
  ]
}
